{
  "schema_version": 1,
  "current": {
    "version": 1,
    "requirements": {
      "REQ-PUBLISH": {
        "text": "Create persistent technical or product posts as drafts, publish explicitly, list only published posts."
      }
    }
  },
  "active": {
    "CHG-SEARCH": {
      "baseline_version": 1,
      "version": 2,
      "status": "verified",
      "delta": [
        {
          "requirement_id": "REQ-SEARCH",
          "old": null,
          "new": {
            "text": "Search title and body case-insensitively; default to published posts, opt in to drafts with --include-drafts."
          },
          "why": "An interrupting privacy requirement must prevent drafts appearing in ordinary search.",
          "confirmation_ref": "SIMULATED-INTERRUPT-CONFIRMED"
        }
      ],
      "tasks": [
        {
          "id": "TASK-SEARCH",
          "requirement_ids": [
            "REQ-SEARCH"
          ],
          "change_version": 2
        }
      ],
      "evidence": [
        {
          "id": "search-v2-tests",
          "requirement_ids": [
            "REQ-SEARCH"
          ],
          "change_version": 2,
          "result": "pass",
          "ref": "../search-v2-tests.log#sha256-code-0756bf97ee59bc2d07a6fc810f9fc9780800068ad8dbcffbb2116f840f0c8d75"
        }
      ]
    },
    "CHG-PARALLEL": {
      "baseline_version": 1,
      "version": 1,
      "status": "implementing",
      "delta": [
        {
          "requirement_id": "REQ-SEARCH",
          "old": null,
          "new": {
            "text": "Search published post titles only."
          },
          "why": "Readers need to find technical posts and product introductions.",
          "confirmation_ref": "SIMULATED-PARALLEL"
        }
      ],
      "tasks": [
        {
          "id": "TASK-SEARCH",
          "requirement_ids": [
            "REQ-SEARCH"
          ],
          "change_version": 1
        }
      ],
      "evidence": []
    }
  },
  "archived": {}
}
