{
  "schema_version": 1,
  "current": {
    "version": 2,
    "requirements": {
      "REQ-PUBLISH": {
        "text": "Create persistent technical or product posts as drafts, publish explicitly, list only published posts."
      },
      "REQ-SEARCH": {
        "text": "Search title and body case-insensitively; default to published posts, opt in to drafts with --include-drafts."
      }
    }
  },
  "active": {},
  "archived": {
    "CHG-PARALLEL": {
      "baseline_version": 1,
      "version": 1,
      "status": "rejected",
      "delta": [
        {
          "requirement_id": "REQ-SEARCH",
          "old": null,
          "new": {
            "text": "Search published post titles only."
          },
          "why": "Readers need to find technical posts and product introductions.",
          "confirmation_ref": "SIMULATED-PARALLEL"
        }
      ],
      "tasks": [
        {
          "id": "TASK-SEARCH",
          "requirement_ids": [
            "REQ-SEARCH"
          ],
          "change_version": 1
        }
      ],
      "evidence": [],
      "archive_reason": "Competing title-only search was superseded; old baseline cannot be promoted."
    },
    "CHG-SEARCH": {
      "baseline_version": 1,
      "version": 2,
      "status": "accepted",
      "delta": [
        {
          "requirement_id": "REQ-SEARCH",
          "old": null,
          "new": {
            "text": "Search title and body case-insensitively; default to published posts, opt in to drafts with --include-drafts."
          },
          "why": "An interrupting privacy requirement must prevent drafts appearing in ordinary search.",
          "confirmation_ref": "SIMULATED-INTERRUPT-CONFIRMED"
        }
      ],
      "tasks": [
        {
          "id": "TASK-SEARCH",
          "requirement_ids": [
            "REQ-SEARCH"
          ],
          "change_version": 2
        }
      ],
      "evidence": [
        {
          "id": "search-v2-tests",
          "requirement_ids": [
            "REQ-SEARCH"
          ],
          "change_version": 2,
          "result": "pass",
          "ref": "../search-v2-tests.log#sha256-code-0756bf97ee59bc2d07a6fc810f9fc9780800068ad8dbcffbb2116f840f0c8d75"
        }
      ],
      "acceptance": {
        "ref": "SIMULATED-ACCEPT-SEARCH-V2",
        "change_id": "CHG-SEARCH",
        "change_version": 2,
        "baseline_version": 1,
        "evidence_version": 2
      },
      "history": [
        {
          "version": 1,
          "reason": "Confirmed privacy interruption invalidated old evidence and acceptance.",
          "evidence": [
            {
              "id": "search-v1-tests",
              "requirement_ids": [
                "REQ-SEARCH"
              ],
              "change_version": 1,
              "result": "pass",
              "ref": "../search-v1-tests.log#sha256-code-040ead77505215308434a8c8c1d60972c3babbc68739236a47be642677db7a0e"
            }
          ],
          "acceptance": {
            "ref": "SIMULATED-ACCEPT-SEARCH-V1",
            "change_id": "CHG-SEARCH",
            "change_version": 1,
            "baseline_version": 1,
            "evidence_version": 1
          }
        }
      ],
      "acceptance_ref": "SIMULATED-ACCEPT-SEARCH-V2",
      "applied_version": 2,
      "archive_reason": "Promoted after privacy interruption, refreshed tests, and SIMULATED acceptance fixture; preserve rationale."
    },
    "CHG-CANCEL": {
      "baseline_version": 2,
      "version": 1,
      "status": "canceled",
      "delta": [
        {
          "requirement_id": "REQ-DELETE",
          "old": null,
          "new": {
            "text": "Allow deleting published posts."
          },
          "why": "Deletion was considered but canceled to preserve the narrow publishing scope.",
          "confirmation_ref": "SIMULATED-CANCEL"
        }
      ],
      "tasks": [
        {
          "id": "TASK-DELETE",
          "requirement_ids": [
            "REQ-DELETE"
          ],
          "change_version": 1
        }
      ],
      "evidence": [],
      "archive_reason": "Canceled to keep this personal publishing project narrow."
    }
  }
}
